Title,Word_Count,Content
Google Overview,448,"Google is one of the most influential technology companies in the world. Founded in 1998 by Larry Page and Sergey Brin while they were PhD students at Stanford University, Google began as a research project to organize the vast amount of information available on the internet. Their goal was to create a search engine that could rank web pages based on relevance and importance, using a unique algorithm known as PageRank. This innovation quickly made Google the preferred search engine for millions of users worldwide.

Over the years, Google expanded far beyond search. The company introduced products and services that have become essential tools in daily life. Gmail revolutionized email with its large storage capacity and powerful spam filtering. Google Maps transformed navigation by providing real-time directions, traffic updates, and satellite imagery. Google Drive enabled cloud storage and collaboration, allowing individuals and businesses to store, share, and edit files from anywhere in the world.

In 2004, Google went public, marking a significant milestone in its growth. The company continued to innovate by acquiring other companies, including YouTube in 2006, which became the world’s largest video-sharing platform. Google also developed the Android operating system, which powers billions of smartphones globally. These strategic expansions helped Google become a dominant force in both software and hardware markets.

Google’s mission statement is “to organize the world’s information and make it universally accessible and useful.” This mission drives its continuous investment in artificial intelligence, machine learning, and data analytics. Google Assistant, Google Translate, and advanced search features are examples of how the company uses AI to enhance user experience. The company also invests heavily in research through its various labs and innovation centers.

In 2015, Google restructured under a parent company called Alphabet Inc. This change allowed Google to focus on its core internet services while Alphabet managed other ambitious projects, such as self-driving cars through Waymo and life sciences research through Verily. This structure supports innovation while maintaining operational efficiency.

Google generates most of its revenue through advertising, particularly via Google Ads. Businesses use Google’s advertising platform to reach targeted audiences, making it a powerful tool for digital marketing. Despite its success, Google has faced criticism and regulatory scrutiny related to privacy concerns, data collection, and market dominance. Governments around the world continue to examine the company’s practices to ensure fair competition and consumer protection.

Today, Google remains at the forefront of technological advancement. From cloud computing with Google Cloud to hardware products like Pixel devices, the company continues to expand its ecosystem. Its influence on communication, business, education, and entertainment is undeniable. As technology evolves, Google’s ability to adapt and innovate will likely determine its future impact on the digital world."
